{
  "artifacts": [
    {
      "kind": "stdout",
      "path": "drop_external_logs_here/example.stdout.txt",
      "sha256": ""
    },
    {
      "kind": "drat",
      "path": "drop_external_logs_here/example.proof",
      "sha256": ""
    }
  ],
  "notes": "Place real solver stdout/proof logs in drop_external_logs_here and rerun scripts/analyze_external_evidence.py.",
  "schema": "gnatural.external_solver_evidence_manifest.external_evidence_gate",
  "solver": {
    "command": "",
    "name": "cadical|kissat|minisat|other"
  },
  "source": "YOUR_MACHINE_OR_CI_RUN"
}
